content,rating,sentiment,original_content,segment_content,_class
播 歌 給 手機 聽 讓 它 找出 歌曲 來 很 好 雖然 都 可以 辨識出 歌曲 但 有些 歌曲 沒有 收錄 喔 原來 是 這樣 我 知道 了,5,0,播歌給手機聽讓它找出歌曲來很好雖然都可以辨識出歌曲但有些歌曲沒有收錄喔原來是這樣我知道了,"[['播', '歌', '給', '手機', '聽', '讓', '它', '找出', '歌曲', '來', '很', '好', '雖然', '都', '可以', '辨識出', '歌曲', '但', '有些', '歌曲', '沒有', '收錄', '喔', '原來', '是', '這樣', '我', '知道', '了']]",0
暢順 好聽,5,0.4,暢順好聽,"[['暢順', '好聽']]",0
不錯,5,0.3,不錯,[['不錯']],0
很 不 錯 的 大部分 原 唱 基本 都 有 還 可以 免 費試聽下載 良心軟 件 了,5,0,很不錯的大部分原唱基本都有還可以免費試聽下載良心軟件了,"[['很', '不錯', '的', '大部分', '原唱', '基本', '都', '有', '還可以', '免費', '試聽', '下載', '良心', '軟件', '了']]",0
剛剛 安裝 就 要 問 祖先 十八 代 真是 夠 了 乾脆 解除 安裝 並且 把 它 廣泛 宣傳,1,0,剛剛安裝就要問祖先十八代真是夠了乾脆解除安裝並且把它廣泛宣傳,"[['剛剛', '安裝', '就', '要', '問', '祖先', '十八', '代', '真是', '夠', '了', '乾脆', '解除', '安裝', '並且', '把', '它', '廣泛', '宣傳']]",4
希望 能夠 在 推出 更 高 的 音質 以及 可以 購買 單曲,5,0,希望能夠在推出更高的音質以及可以購買單曲,"[['希望', '能夠', '在', '推出', '更', '高', '的', '音質', '以及', '可以', '購買', '單曲']]",0
一直 呈現 跑 的 狀態 一直 跑不動 不能 聽 已 更新 也 是,2,-0.25,一直呈現跑的狀態一直跑不動不能聽已更新也是,"[['一直', '呈現', '跑', '的', '狀態', '一直', '跑不動', '不能', '聽', '已', '更新', '也', '是']]",4
別的 先 不 說 狀態欄 不 沉浸 就 很 難受,2,-0.5,別的先不說狀態欄不沉浸就很難受,"[['別的', '先', '不', '說', '狀態欄', '不', '沉浸', '就', '很', '難受']]",4
無法 使用 免費 聽 拜託 可以 盡快 修復 嗎,3,-0.4666666667,無法使用免費聽拜託可以盡快修復嗎,"[['無法', '使用', '免費', '聽', '拜託', '可以', '盡快', '修復', '嗎']]",0
方便 好用,5,0.3,方便好用,"[['方便', '好用']]",0
沒有 免費 聽 了 只 剩 試聽,3,-0.3,沒有免費聽了只剩試聽,"[['沒有', '免費', '聽', '了', '只', '剩', '試聽']]",0
聲音 是 不 錯 可是 很少 現 在 流行 的 歌,2,0.5,聲音是不錯可是很少現在流行的歌,"[['聲音', '是', '不錯', '可是', '很少', '現在', '流行', '的', '歌']]",4
最 愛 必備 的 程式,5,0,最愛必備的程式,"[['最', '愛', '必備', '的', '程式']]",0
剛 下載 好 為什麼 都 不能 登錄 能不能 用 好 一點 在 給 我 我們 下載,1,0.025,剛下載好為什麼都不能登錄能不能用好一點在給我我們下載,"[['剛', '下載', '好', '為什麼', '都', '不能', '登錄', '能不能', '用', '好', '一點', '在', '給', '我', '我們', '下載']]",3
自從 更新 後邊 聽 歌 邊 使用 其他 應用 程式 時 會 一直 自動 閃退 無法 與 其他 一起 使用,3,-0.6,自從更新後邊聽歌邊使用其他應用程式時會一直自動閃退無法與其他一起使用,"[['自從', '更新', '後邊', '聽', '歌', '邊', '使用', '其他', '應用', '程式', '時', '會', '一直', '自動', '閃退', '無法', '與', '其他', '一起', '使用']]",0
不好意思 為什麼 有些 歌手 的 整 張 專輯 突然 下架 呢 聽完 一 次 後 要 聽 第二 次 後 就 顯示 未 授權 了 之前 都 還可以 聽 希望 能 趕快 重新 上架 這 個 專輯 就 整 個 下架 了,2,-0.25,不好意思為什麼有些歌手的整張專輯突然下架呢聽完一次後要聽第二次後就顯示未授權了之前都還可以聽希望能趕快重新上架這個專輯就整個下架了,"[['不好意思', '為什麼', '有些', '歌手', '的', '整', '張', '專輯', '突然', '下架', '呢', '聽完', '一', '次', '後', '要', '聽', '第二', '次', '後', '就', '顯示', '未', '授權', '了', '之前', '都', '還可以', '聽', '希望', '能', '趕快', '重新', '上架', '這', '個', '專輯', '就', '整', '個', '下架', '了']]",4
希望 可以 用 支付 寶付款,2,0,希望可以用支付寶付款,"[['希望', '可以', '用', '支付', '寶付款']]",4
旋轉 手機 閃退 的 問題 已 暫時 解決 希望 能 早日 確實 解決 改善 後 補 五星 評價,4,-0.2,旋轉手機閃退的問題已暫時解決希望能早日確實解決改善後補五星評價,"[['旋轉', '手機', '閃退', '的', '問題', '已', '暫時', '解決', '希望', '能', '早日', '確實', '解決', '改善', '後', '補', '五星', '評價']]",0
一 開起來 就 閃退 儲值 了 會員 卻 不能 用 讓 人 感覺 很 差,1,-0.45,一開起來就閃退儲值了會員卻不能用讓人感覺很差,"[['一', '開起來', '就', '閃退', '儲值', '了', '會員', '卻', '不能', '用', '讓', '人', '感覺', '很', '差']]",1
能 聽到 很多 不同 類型 的 歌曲 也 能 聽到 來自 其他 地區 第一手 的 新歌 發表,5,0,能聽到很多不同類型的歌曲也能聽到來自其他地區第一手的新歌發表,"[['能', '聽到', '很多', '不同', '類型', '的', '歌曲', '也', '能', '聽到', '來自', '其他', '地區', '第一手', '的', '新歌', '發表']]",0
沒 有的 進 不 到 就 很 煩,1,0,沒有的進不到就很煩,"[['沒有', '的', '進', '不', '到', '就', '很', '煩']]",4
人性化 設計,5,0,人性化設計,"[['人性化', '設計']]",0
我 是 使用 自從 最近 更新 後 便 開始 一直 閃退 希望 可以 改善,3,-0.55,我是使用自從最近更新後便開始一直閃退希望可以改善,"[['我', '是', '使用', '自從', '最近', '更新', '後', '便', '開始', '一直', '閃退', '希望', '可以', '改善']]",0
有 最 新 一 期 的 歌曲 方便 使用,4,0.2,有最新一期的歌曲方便使用,"[['有', '最', '新', '一', '期', '的', '歌曲', '方便', '使用']]",0
垃圾 垃圾 垃圾,1,-0.5,垃圾垃圾垃圾,"[['垃圾', '垃圾', '垃圾']]",4
最近 怎麼 常常 聽 一 聽 忽然 被 關掉 就 像 被 按 了 方塊鍵 一樣 重新 下載 還 是 一樣 手機 型號,4,-0.2,最近怎麼常常聽一聽忽然被關掉就像被按了方塊鍵一樣重新下載還是一樣手機型號,"[['最近', '怎麼', '常常', '聽', '一', '聽', '忽然', '被', '關掉', '就', '像', '被', '按', '了', '方塊鍵', '一樣', '重新', '下載', '還', '是', '一樣', '手機', '型號']]",0
這 個 是 登入 後天 過 了 就 要 付費 嗎,4,-0.1,這個是登入後天過了就要付費嗎,"[['這', '個', '是', '登入', '後天', '過', '了', '就', '要', '付費', '嗎']]",0
我 使用 更新 到 後 一直 不停 閃退 可以 麻煩 解決 嗎 感謝,4,-0.325,我使用更新到後一直不停閃退可以麻煩解決嗎感謝,"[['我', '使用', '更新', '到', '後', '一直', '不停', '閃退', '可以', '麻煩', '解決', '嗎', '感謝']]",0
我 覺 得 還 好 但是 可能 是 我 的 網絡 有 點爛 感覺 搜索 的 速度 有 點慢 而且 我 要 找 的 歌 有 些 不 是 原唱 希望 能不要 收費,3,0.3,我覺得還好但是可能是我的網絡有點爛感覺搜索的速度有點慢而且我要找的歌有些不是原唱希望能不要收費,"[['我', '覺得', '還好', '但是', '可能', '是', '我', '的', '網絡', '有點', '爛', '感覺', '搜索', '的', '速度', '有點', '慢', '而且', '我', '要', '找', '的', '歌', '有', '些', '不', '是', '原唱', '希望', '能不要', '收費']]",0
去 哦 就 啊 吃 開車 妻子 是 妳 吃 奶字 開車 哦 你 喔 吃 你 既 呢及 奶茶 嗯 褲子 可 拆 欸 幹雸 給 卡片 吃 欸 幹 詐欺 而 哭 喔 嘎 健康 呃 上課 喔 吃 你 賊 開機 你 賊 感覺 喔 開頭 喔喔 吃 哦 開車 喔 乃 拆 請教 喔 嘎嘎開 看 小姐 恩膏 擦開 高中 的 嗯 而 而 而 而 而 而 而已 五 看 欸 酷 哦 刺 欸 吃 欸 看過 哦 常常 哦 鐵閘 鐵閘 啊 您 喔 酷 哦 一 吃 米酒 牛仔褲 欸 吃 你 吃 哦 很 差 欸 哭宅 開車 哦 米 愛 嘎 之 天恩 烤翅 四 熱 用 行程 喔 可 草 你 吃 哦 課本 自殺 指 這 只 佔 欸 再見 小恩字 呢 宅配 他 至 阿哥 賊 現在 聽 你 進來 你 幹嘛 提及 黑市 開啟 喔 只 提供 而 拚排 啊 張 太太 之 門 按 該 感覺 喔 投資 喔 你 喔 誰 可 拆 機車 喔 可 起來 吃 妻子 米 欸 成功 因 引起 雸音 感爾 給 在 臺 內 資白癡 哦 他 欸 那 燒 內在 做 嘎 之 噴噴 在 跟去 欸 字 呢 吃 欸 愛 張 空間 偶爾 啊子 按咁 給 他 欸 買 的 套 汽車 擴音器 欸 字 呢 喔 吃 嫩口賊 談談 他 阿爾 跟 摸吃 嫩爾內 吃 他 誰 悶騷 網囊 此 漫畫 岑內 是 老總 牛仔 誒 尬 欸 日 吃 開頭 沉迷 引擎 金恩 則 在 各 民族 賠償 哦 拍 窄 欸 吃 過去 哦米 贓款 嫩模 去 哦 健康 阿爾 開車 欸 看見 啊 欸 吃 開心奧 此 乃 吃 你 喔 腦 算命 吃 欸 你 去 嗯 無名指 艾米 警方 及 你 喔 吃看 欸 磁卡 知識 欸 講 欸 抗 癌 噴 肝癌 太 昂 哦 今天 誒 怪 咖 愛 開機 賊星 欸 字 去 欸 字 開心 餓哭 是 妳 車 呢 及 看 欸 看 欸 警察 嘅 癡漢 感知 乾柴賊 可 草 看 現在 你 既 啤酒奶 迫切 啊 你 吃 欸 起 而 按照 太監 啊 他 只 聽見 喔 欸 字 開車 你 吃 哦 魔鏡 那 個 而 寶可夢,5,-0.2,去哦就啊吃開車妻子是妳吃奶字開車哦你喔吃你既呢及奶茶嗯褲子可拆欸幹雸給卡片吃欸幹詐欺而哭喔嘎健康呃上課喔吃你賊開機你賊感覺喔開頭喔喔吃哦開車喔乃拆請教喔嘎嘎開看小姐恩膏擦開高中的嗯而而而而而而而已五看欸酷哦刺欸吃欸看過哦常常哦鐵閘鐵閘啊您喔酷哦一吃米酒牛仔褲欸吃你吃哦很差欸哭宅開車哦米愛嘎之天恩烤翅四熱用行程喔可草你吃哦課本自殺指這只佔欸再見小恩字呢宅配他至阿哥賊現在聽你進來你幹嘛提及黑市開啟喔只提供而拚排啊張太太之門按該感覺喔投資喔你喔誰可拆機車喔可起來吃妻子米欸成功因引起雸音感爾給在臺內資白癡哦他欸那燒內在做嘎之噴噴在跟去欸字呢吃欸愛張空間偶爾啊子按咁給他欸買的套汽車擴音器欸字呢喔吃嫩口賊談談他阿爾跟摸吃嫩爾內吃他誰悶騷網囊此漫畫岑內是老總牛仔誒尬欸日吃開頭沉迷引擎金恩則在各民族賠償哦拍窄欸吃過去哦米贓款嫩模去哦健康阿爾開車欸看見啊欸吃開心奧此乃吃你喔腦算命吃欸你去嗯無名指艾米警方及你喔吃看欸磁卡知識欸講欸抗癌噴肝癌太昂哦今天誒怪咖愛開機賊星欸字去欸字開心餓哭是妳車呢及看欸看欸警察嘅癡漢感知乾柴賊可草看現在你既啤酒奶迫切啊你吃欸起而按照太監啊他只聽見喔欸字開車你吃哦魔鏡那個而寶可夢,"[['去', '哦', '就', '啊', '吃', '開車', '妻子', '是', '妳', '吃', '奶字', '開車', '哦', '你', '喔', '吃', '你', '既', '呢及', '奶茶', '嗯', '褲子', '可', '拆', '欸', '幹雸', '給', '卡片', '吃', '欸', '幹', '詐欺', '而', '哭', '喔', '嘎', '健康', '呃', '上課', '喔', '吃', '你', '賊', '開機', '你', '賊', '感覺', '喔', '開頭', '喔喔', '吃', '哦', '開車', '喔', '乃', '拆', '請教', '喔', '嘎嘎開', '看', '小姐', '恩膏', '擦開', '高中', '的', '嗯', '而', '而', '而', '而', '而', '而', '而已', '五', '看', '欸', '酷', '哦', '刺', '欸', '吃', '欸', '看過', '哦', '常常', '哦', '鐵閘', '鐵閘', '啊', '您', '喔', '酷', '哦', '一', '吃', '米酒', '牛仔褲', '欸', '吃', '你', '吃', '哦', '很', '差', '欸', '哭宅', '開車', '哦', '米', '愛', '嘎', '之', '天恩', '烤翅', '四', '熱', '用', '行程', '喔', '可', '草', '你', '吃', '哦', '課本', '自殺', '指', '這', '只', '佔', '欸', '再見', '小恩字', '呢', '宅配', '他', '至', '阿哥', '賊', '現在', '聽', '你', '進來', '你', '幹嘛', '提及', '黑市', '開啟', '喔', '只', '提供', '而', '拚排', '啊', '張', '太太', '之', '門', '按', '該', '感覺', '喔', '投資', '喔', '你', '喔', '誰', '可', '拆', '機車', '喔', '可', '起來', '吃', '妻子', '米', '欸', '成功', '因', '引起', '雸音', '感爾', '給', '在', '臺', '內', '資白癡', '哦', '他', '欸', '那', '燒', '內在', '做', '嘎', '之', '噴噴', '在', '跟去', '欸', '字', '呢', '吃', '欸', '愛', '張', '空間', '偶爾', '啊子', '按咁', '給', '他', '欸', '買', '的', '套', '汽車', '擴音器', '欸', '字', '呢', '喔', '吃', '嫩口賊', '談談', '他', '阿爾', '跟', '摸吃', '嫩爾內', '吃', '他', '誰', '悶騷', '網囊', '此', '漫畫', '岑內', '是', '老總', '牛仔', '誒', '尬', '欸', '日', '吃', '開頭', '沉迷', '引擎', '金恩', '則', '在', '各', '民族', '賠償', '哦', '拍', '窄', '欸', '吃', '過去', '哦米', '贓款', '嫩模', '去', '哦', '健康', '阿爾', '開車', '欸', '看見', '啊', '欸', '吃', '開心奧', '此', '乃', '吃', '你', '喔', '腦', '算命', '吃', '欸', '你', '去', '嗯', '無名指', '艾米', '警方', '及', '你', '喔', '吃看', '欸', '磁卡', '知識', '欸', '講', '欸', '抗', '癌', '噴', '肝癌', '太', '昂', '哦', '今天', '誒', '怪', '咖', '愛', '開機', '賊星', '欸', '字', '去', '欸', '字', '開心', '餓哭', '是', '妳', '車', '呢', '及', '看', '欸', '看', '欸', '警察', '嘅', '癡漢', '感知', '乾柴賊', '可', '草', '看', '現在', '你', '既', '啤酒奶', '迫切', '啊', '你', '吃', '欸', '起', '而', '按照', '太監', '啊', '他', '只', '聽見', '喔', '欸', '字', '開車', '你', '吃', '哦', '魔鏡', '那', '個', '而', '寶可夢']]",0
關起 手機 還 能 聽 音樂 是 個 很 棒 的 功能,5,0.5,關起手機還能聽音樂是個很棒的功能,"[['關起', '手機', '還', '能', '聽', '音樂', '是', '個', '很', '棒', '的', '功能']]",0
很 好用,5,0.4,很好用,"[['很', '好用']]",0
歌曲 豐富 但 希望 使用 介面 能 再 提高 可以 更 好看,3,0.5,歌曲豐富但希望使用介面能再提高可以更好看,"[['歌曲', '豐富', '但', '希望', '使用', '介面', '能', '再', '提高', '可以', '更', '好看']]",0
小 工具 有點 寒酸 不能 調 歌詞 大小 不能 播 手機 裡 的 還 有 為什麼 都 付 了 錢 還要 看 你 那些 討厭 的 廣告 莫名其妙 想 聽 的 都 變 未 授權 什麼 時候 上架 不 知道 付錢 的 時候 可以 聽 的 有沒有 在 維護 啊,1,-0.3375,小工具有點寒酸不能調歌詞大小不能播手機裡的還有為什麼都付了錢還要看你那些討厭的廣告莫名其妙想聽的都變未授權什麼時候上架不知道付錢的時候可以聽的有沒有在維護啊,"[['小', '工具', '有點', '寒酸', '不能', '調', '歌詞', '大小', '不能', '播', '手機', '裡', '的', '還', '有', '為什麼', '都', '付', '了', '錢', '還要', '看', '你', '那些', '討厭', '的', '廣告', '莫名其妙', '想', '聽', '的', '都', '變', '未', '授權', '什麼', '時候', '上架', '不', '知道', '付錢', '的', '時候', '可以', '聽', '的', '有沒有', '在', '維護', '啊']]",2
為什麼 我 聽 歌 聽到 一半 要 切回 上 一 首 歌 的 時候 它 會 先 跳回 原來 這 首 歌 的 開頭 然後 在 點 第二 次 上 一 首 歌 的 按鍵 才 能 切換 請 修復,4,-0.35,為什麼我聽歌聽到一半要切回上一首歌的時候它會先跳回原來這首歌的開頭然後在點第二次上一首歌的按鍵才能切換請修復,"[['為什麼', '我', '聽', '歌', '聽到', '一半', '要', '切回', '上', '一', '首', '歌', '的', '時候', '它', '會', '先', '跳回', '原來', '這', '首', '歌', '的', '開頭', '然後', '在', '點', '第二', '次', '上', '一', '首', '歌', '的', '按鍵', '才', '能', '切換', '請', '修復']]",0
很 流暢 很 好用,5,0.35,很流暢很好用,"[['很', '流暢', '很', '好用']]",0
不 知道 是 不 是 不 支援 每 一 款 手機 我 的 沒有 動態 歌詞,5,-0.3,不知道是不是不支援每一款手機我的沒有動態歌詞,"[['不', '知道', '是', '不', '是', '不', '支援', '每', '一', '款', '手機', '我', '的', '沒有', '動態', '歌詞']]",0
希望 可以 增加 歌曲 置頂 的 功能,4,0,希望可以增加歌曲置頂的功能,"[['希望', '可以', '增加', '歌曲', '置頂', '的', '功能']]",0
超級 好 神級,5,0.3,超級好神級,"[['超級', '好', '神級']]",0
我 的 手機 型號 是 最近 更新 後 只要 每 次 開啟 聽 歌 時 都 會 閃退 而且 已經 好幾 次 了 而且 每 次 重開 都 會 閃退 已經 連續 好幾 天 這樣 了 希望 你們 盡快 改進,2,-0.575,我的手機型號是最近更新後只要每次開啟聽歌時都會閃退而且已經好幾次了而且每次重開都會閃退已經連續好幾天這樣了希望你們盡快改進,"[['我', '的', '手機', '型號', '是', '最近', '更新', '後', '只要', '每', '次', '開啟', '聽', '歌', '時', '都', '會', '閃退', '而且', '已經', '好幾', '次', '了', '而且', '每', '次', '重開', '都', '會', '閃退', '已經', '連續', '好幾', '天', '這樣', '了', '希望', '你們', '盡快', '改進']]",1
請問 一定 要 付費 嗎,3,-0.1,請問一定要付費嗎,"[['請問', '一定', '要', '付費', '嗎']]",0
