content,rating,sentiment,original_content,segment_content,_class
琢磨 音樂 聽 聽 下 就 沒 有 料 我 一直 要 進 去 按 過,1,0,琢磨音樂聽聽下就沒有料我一直要進去按過,"[['琢磨', '音樂', '聽聽', '下', '就', '沒有', '料', '我', '一直', '要', '進去', '按', '過']]",4
你 好 為何 有些 歌曲 之前 聽到 但 現在 突然 聽 不 到 說 版權 有 問題 下架 那 會 再 上架 嗎 另外 有 很多 歌手 有 他 比較 新 的 專輯 但 舊 一點 的 專輯 沒有 可以 加回 上去 嗎,3,-0.125,你好為何有些歌曲之前聽到但現在突然聽不到說版權有問題下架那會再上架嗎另外有很多歌手有他比較新的專輯但舊一點的專輯沒有可以加回上去嗎,"[['你', '好', '為何', '有些', '歌曲', '之前', '聽到', '但', '現在', '突然', '聽', '不', '到', '說', '版權', '有', '問題', '下架', '那', '會', '再', '上架', '嗎', '另外', '有', '很多', '歌手', '有', '他', '比較', '新', '的', '專輯', '但', '舊', '一點', '的', '專輯', '沒有', '可以', '加回', '上去', '嗎']]",0
戎婉瑜,5,0,戎婉瑜,[['戎婉瑜']],0
好用,4,0.4,好用,[['好用']],0
媽 得 不 在 訂閱 一直 幫 我 續訂 看,1,0,媽得不在訂閱一直幫我續訂看,"[['媽', '得', '不', '在', '訂閱', '一直', '幫', '我', '續訂', '看']]",4
很 方便,5,0.2,很方便,"[['很', '方便']]",0
基本 功能 一流 惟 不能 播放 手機 或 內歌曲,4,0.25,基本功能一流惟不能播放手機或內歌曲,"[['基本', '功能', '一流', '惟', '不能', '播放', '手機', '或', '內歌曲']]",0
請問 我 的 手機 無法 正常 下載 程式 型號 要 如何 處理 之前 有 正常 下載 但 到 現在 就 無法 下載 了 是 不 是 要 直接 反應給 比較 快 解決 問題,5,-0.4,請問我的手機無法正常下載程式型號要如何處理之前有正常下載但到現在就無法下載了是不是要直接反應給比較快解決問題,"[['請問', '我', '的', '手機', '無法', '正常', '下載', '程式', '型號', '要', '如何', '處理', '之前', '有', '正常', '下載', '但', '到', '現在', '就', '無法', '下載', '了', '是', '不', '是', '要', '直接', '反應給', '比較', '快', '解決', '問題']]",0
愛上 好 心情,5,0.3,愛上好心情,"[['愛上', '好', '心情']]",0
不錯,5,0.3,不錯,[['不錯']],0
爛,1,-0.3,爛,[['爛']],4
我 覺得 想 聽 的 歌曲 大致 都 可以 找到 還 不錯 用,5,0.3,我覺得想聽的歌曲大致都可以找到還不錯用,"[['我', '覺得', '想', '聽', '的', '歌曲', '大致', '都', '可以', '找到', '還', '不錯', '用']]",0
爛,1,-0.3,爛,[['爛']],4
請問 既然 都 是 付費 有 授權 的 歌曲 了 難道 把 歌詞 弄上去 很 難 嗎 做 不 到 同步 就 算 了 每 次 都 是 空白 這 以 經 忍耐 很 久 了 到底 改 不 改做 不 到 就 把 功能 項目 的 歌詞 拿掉 吧 越來越 爛 了 付費 這麼多 年 感覺 越來越 差,1,-0.24,請問既然都是付費有授權的歌曲了難道把歌詞弄上去很難嗎做不到同步就算了每次都是空白這以經忍耐很久了到底改不改做不到就把功能項目的歌詞拿掉吧越來越爛了付費這麼多年感覺越來越差,"[['請問', '既然', '都', '是', '付費', '有', '授權', '的', '歌曲', '了', '難道', '把', '歌詞', '弄上去', '很', '難', '嗎', '做', '不', '到', '同步', '就', '算', '了', '每', '次', '都', '是', '空白', '這', '以', '經', '忍耐', '很', '久', '了', '到底', '改', '不', '改做', '不', '到', '就', '把', '功能', '項目', '的', '歌詞', '拿掉', '吧', '越來越', '爛', '了', '付費', '這麼多', '年', '感覺', '越來越', '差']]",4
讚,5,0,讚,[['讚']],0
整體 不錯 不過 建議 地方 可以 開啟 程式 後 就 有 個 播放 功能 直接 自動 放 上 次 聽 的 音樂 相信 有 不少 有 相同 需求 跟 是否 可以 加速 與 的 支援 不然 很 不 方便 都 想 跳槽 了,4,0.4,整體不錯不過建議地方可以開啟程式後就有個播放功能直接自動放上次聽的音樂相信有不少有相同需求跟是否可以加速與的支援不然很不方便都想跳槽了,"[['整體', '不錯', '不過', '建議', '地方', '可以', '開啟', '程式', '後', '就', '有', '個', '播放', '功能', '直接', '自動', '放', '上', '次', '聽', '的', '音樂', '相信', '有', '不少', '有', '相同', '需求', '跟', '是否', '可以', '加速', '與', '的', '支援', '不然', '很', '不', '方便', '都', '想', '跳槽', '了']]",0
基本 功能 一流 惟 不能 播放 手機 或 內歌曲 和 更改 非 分享 歌單 的 封面 照片,4,0.25,基本功能一流惟不能播放手機或內歌曲和更改非分享歌單的封面照片,"[['基本', '功能', '一流', '惟', '不能', '播放', '手機', '或', '內歌曲', '和', '更改', '非', '分享', '歌單', '的', '封面', '照片']]",0
為什麼 我 點 了 這 首 歌 卻 只 播 了 秒 之後 就 所有 歌 都 是 只 能 播 秒 求 解答,1,-0.3,為什麼我點了這首歌卻只播了秒之後就所有歌都是隻能播秒求解答,"[['為什麼', '我', '點', '了', '這', '首', '歌', '卻', '只', '播', '了', '秒', '之後', '就', '所有', '歌', '都', '是', '隻', '能', '播', '秒', '求', '解答']]",2
方便,5,0.2,方便,[['方便']],0
喜歡,5,0.5,喜歡,[['喜歡']],0
希望 邊 聽 邊 下載 可以 多 一 個 淘汰 天 沒 聽 的 歌曲 試聽 音樂 時 有 喜歡 的 會 加到 歌曲 裡 之後 繼續 聽 可是 沒有 喜歡 的 也 還 一直 佔 著 手機 容量,5,0.2333333333,希望邊聽邊下載可以多一個淘汰天沒聽的歌曲試聽音樂時有喜歡的會加到歌曲裡之後繼續聽可是沒有喜歡的也還一直佔著手機容量,"[['希望', '邊', '聽', '邊', '下載', '可以', '多', '一', '個', '淘汰', '天', '沒', '聽', '的', '歌曲', '試聽', '音樂', '時', '有', '喜歡', '的', '會', '加到', '歌曲', '裡', '之後', '繼續', '聽', '可是', '沒有', '喜歡', '的', '也', '還', '一直', '佔', '著', '手機', '容量']]",0
不能 下載,5,-0.2,不能下載,"[['不能', '下載']]",0
希望 能 推薦 歌曲 的 功能 有點 用,5,0.7,希望能推薦歌曲的功能有點用,"[['希望', '能', '推薦', '歌曲', '的', '功能', '有點', '用']]",0
要 錢 的,2,0,要錢的,"[['要', '錢', '的']]",4
請問 可以 把 音質 提升 嗎,1,0,請問可以把音質提升嗎,"[['請問', '可以', '把', '音質', '提升', '嗎']]",4
紅日,5,0,紅日,[['紅日']],0
多 年 老 用戶 好用 不 多 說,5,0.4,多年老用戶好用不多說,"[['多', '年', '老', '用戶', '好用', '不', '多', '說']]",0
為什麼 我 點 了 這 首 歌 卻 只 播 了 秒 之後 就 所有 歌 都 是 只 能 播 秒 求 解答,1,-0.3,為什麼我點了這首歌卻只播了秒之後就所有歌都是隻能播秒求解答,"[['為什麼', '我', '點', '了', '這', '首', '歌', '卻', '只', '播', '了', '秒', '之後', '就', '所有', '歌', '都', '是', '隻', '能', '播', '秒', '求', '解答']]",2
很 好用 但 如果 兩 臺 手機 用 同 個 會員 有時候 會 斷線 還 有 更新 後 收藏 歌曲 功能 可不可以 設 在 原本 的 地方,4,0,很好用但如果兩臺手機用同個會員有時候會斷線還有更新後收藏歌曲功能可不可以設在原本的地方,"[['很', '好用', '但', '如果', '兩', '臺', '手機', '用', '同', '個', '會員', '有時候', '會', '斷線', '還', '有', '更新', '後', '收藏', '歌曲', '功能', '可不可以', '設', '在', '原本', '的', '地方']]",0
好 的,5,0.3,好的,"[['好', '的']]",0
好 差 所以 歌 只 能 聽 秒 歌詞 又 沒有 離線 聽 又 要 給 錢 先 享有 會員 福利,1,0,好差所以歌只能聽秒歌詞又沒有離線聽又要給錢先享有會員福利,"[['好', '差', '所以', '歌', '只', '能', '聽', '秒', '歌詞', '又', '沒有', '離線', '聽', '又', '要', '給', '錢', '先', '享有', '會員', '福利']]",4
好用,5,0.4,好用,[['好用']],0
很 棒,5,0.5,很棒,"[['很', '棒']]",0
手機版 電臺 都 沒有 萬 首 歌 一起 聽 都 沒有 萬 首 歌歌曲 都 沒有 萬 首 歌 專輯 都 沒有 萬 首 歌 電臺 歌 都 沒有 萬 首 歌電臺 歌曲 都 沒有 萬 首 歌歌 名 都 沒有 萬 首 歌歌手 名字 都 沒有 萬 首 歌圖 騙人 萬 首 歌 都 沒有 萬 首 歌 改善 為什麼 只有 電腦版 才 有 萬 首 歌爛 改善 手機版 很 爛 很 爛 電臺 沒 萬 首 歌爛 很 爛 發現 沒 萬 首 歌 爛爛 到 爆沒 改進 爛 沒 改善 爛 手機 爛 沒 萬 首 歌爛 改進 改善 手機版 只有 常常 換 首 歌 而已 沒 萬 首 歌爛 手機版 不要 每 週一 直 更新 要 有 萬 首 歌,1,-0.352173913,手機版電臺都沒有萬首歌一起聽都沒有萬首歌歌曲都沒有萬首歌專輯都沒有萬首歌電臺歌都沒有萬首歌電臺歌曲都沒有萬首歌歌名都沒有萬首歌歌手名字都沒有萬首歌圖騙人萬首歌都沒有萬首歌改善為什麼只有電腦版纔有萬首歌爛改善手機版很爛很爛電臺沒萬首歌爛很爛發現沒萬首歌爛爛到爆沒改進爛沒改善爛手機爛沒萬首歌爛改進改善手機版只有常常換首歌而已沒萬首歌爛手機版不要每週一直更新要有萬首歌,"[['手機版', '電臺', '都', '沒有', '萬', '首', '歌', '一起', '聽', '都', '沒有', '萬', '首', '歌歌曲', '都', '沒有', '萬', '首', '歌', '專輯', '都', '沒有', '萬', '首', '歌', '電臺歌', '都', '沒有', '萬', '首', '歌', '電臺', '歌曲', '都', '沒有', '萬', '首', '歌歌', '名', '都', '沒有', '萬', '首', '歌歌手', '名字', '都', '沒有', '萬', '首', '歌圖', '騙人', '萬', '首', '歌', '都', '沒有', '萬', '首', '歌', '改善', '為什麼', '只有', '電腦版', '纔', '有', '萬', '首', '歌爛', '改善', '手機版', '很', '爛', '很', '爛', '電臺', '沒', '萬', '首', '歌爛', '很', '爛', '發現', '沒', '萬', '首', '歌', '爛爛', '到', '爆沒', '改進', '爛', '沒', '改善', '爛', '手機', '爛', '沒', '萬', '首', '歌爛', '改進', '改善', '手機版', '只有', '常常', '換', '首', '歌', '而已', '沒', '萬', '首', '歌爛', '手機版', '不要', '每', '週一', '直', '更新', '要', '有', '萬', '首', '歌']]",4
怎麼 一定 要 付 費 才 能 使用,1,0,怎麼一定要付費才能使用,"[['怎麼', '一定', '要', '付費', '才', '能', '使用']]",4
已 改善 繼續 支持,5,0.05,已改善繼續支持,"[['已', '改善', '繼續', '支持']]",0
要 錢 不 好,1,0.3,要錢不好,"[['要', '錢', '不', '好']]",4
要 提供 音質 的 服務 了 但 什麼 時候 開始 我們 一般人 才 能 訂閱 呢,5,0,要提供音質的服務了但什麼時候開始我們一般人才能訂閱呢,"[['要', '提供', '音質', '的', '服務', '了', '但', '什麼', '時候', '開始', '我們', '一般人', '才', '能', '訂閱', '呢']]",0
軟體 更新 後 認養 歌詞 的 功能 不再 只 限於 用 電腦版 上 了 還 能 使用 手機版 認養 歌詞 讓 認養 歌詞 更加 方便,4,0.2,軟體更新後認養歌詞的功能不再只限於用電腦版上了還能使用手機版認養歌詞讓認養歌詞更加方便,"[['軟體', '更新', '後', '認養', '歌詞', '的', '功能', '不再', '只', '限於', '用', '電腦版', '上', '了', '還', '能', '使用', '手機版', '認養', '歌詞', '讓', '認養', '歌詞', '更加', '方便']]",0
一點 也 不 好用 歌曲 只有 秒 播放 又 不能 離線 播放 總 有 大部分 歌 遲遲 都 沒 上架 垃圾,1,-0.1,一點也不好用歌曲只有秒播放又不能離線播放總有大部分歌遲遲都沒上架垃圾,"[['一點', '也', '不', '好用', '歌曲', '只有', '秒', '播放', '又', '不能', '離線', '播放', '總', '有', '大部分', '歌', '遲遲', '都', '沒', '上架', '垃圾']]",4
最近 只要 切離 畫面 沒 多久 就 會 閃退 背景 音樂 直接 消失 以及 自 定義 歌單 的 順序 有時候 會 突然 亂掉 導致 自己 又 要 重排 很 擾人,1,-0.475,最近只要切離畫面沒多久就會閃退背景音樂直接消失以及自定義歌單的順序有時候會突然亂掉導致自己又要重排很擾人,"[['最近', '只要', '切離', '畫面', '沒', '多久', '就', '會', '閃退', '背景', '音樂', '直接', '消失', '以及', '自', '定義', '歌單', '的', '順序', '有時候', '會', '突然', '亂掉', '導致', '自己', '又', '要', '重排', '很', '擾人']]",1
真的 好用 但 希望 各 國 的 能夠 互通,5,0.25,真的好用但希望各國的能夠互通,"[['真的', '好用', '但', '希望', '各', '國', '的', '能夠', '互通']]",0
全部 下載 好 的 歌 都 變秒 了 點來 聽 的 也 是 秒,1,0.3,全部下載好的歌都變秒了點來聽的也是秒,"[['全部', '下載', '好', '的', '歌', '都', '變', '秒', '了', '點', '來', '聽', '的', '也', '是', '秒']]",4
可以 把 的 翻唱 加到 裡面 嗎,4,0,可以把的翻唱加到裡面嗎,"[['可以', '把', '的', '翻唱', '加到', '裡面', '嗎']]",0
幹 你 娘 不要 每 次 聽 第一 首 歌 的 時候 就 突然 斷掉 好 嗎,1,-0.3,幹你娘不要每次聽第一首歌的時候就突然斷掉好嗎,"[['幹', '你', '娘', '不要', '每', '次', '聽', '第一', '首', '歌', '的', '時候', '就', '突然', '斷掉', '好', '嗎']]",4
為什麼 我 下載 的 歌 會 一直 不 見 啊 啊 啊 啊 啊,5,-0.3,為什麼我下載的歌會一直不見啊啊啊啊啊,"[['為什麼', '我', '下載', '的', '歌', '會', '一直', '不', '見', '啊', '啊', '啊', '啊', '啊']]",0
好用,5,0.4,好用,[['好用']],0
我 想 問 一下爲 什麼 註冊不了,5,0,我想問一下爲什麼註冊不了,"[['我', '想', '問', '一下', '爲', '什麼', '註冊', '不了']]",0
音樂 還 不錯,5,0.3,音樂還不錯,"[['音樂', '還', '不錯']]",0
不 錯 的 應 用 希望 越 做 越 好 還 有 一 個 地方 好 東西 要 分享 給 大家 瀏覽器 輸 入下載簡體 中文 界面 最 大 華人娛樂網站 英國 政府 頒發執 照 安全無憂 體育 下注 電競 下 注 真人 美女 百家樂 老虎 機捕 魚 棋牌 彩票 電子 遊藝 等 各 種頂級娛樂 遊戲 你 找 的 裏面 都 有 不 去 試試 太 可惜 了 瀏覽器輸 入 下載 生活 是 開水不論 冷熱 只要 有 適合 的 溫度 就 好 生活 是 口味 不 論酸甜苦辣 只要 有 適合 的 口感 就 好 生活 是 季節 不 論 春 夏 秋冬 只要 有 適合 的 心情 就 好 生活 就 是 實實 在在 的 生存 只要 適合 自己 就 是 一 種幸福 莫 要強 求 隨心 就 好莫 要 奢求 安樂 就 好 潮 起 潮落 花開 花落 是 自然界 亙古不變 的 法則人 也 遵循 着 跌宕 起伏 在 所 難 免 關鍵 在 於能夠 戒驕 戒躁 在 頂端時 好好 享受 在 低谷時 不失 勇氣 與 其 在 風雨 中 逃避 不如 在 雷電 中 舞蹈 即便 淋 得 透溼 也 是 領 略 生命 的 怯意 也 許 路途 有 點艱 辛有 點 孤獨 但 熬過 了 痛苦 我 們 才 能 得以 成長 我 是 一 個 淡淡 的 女子 身在 紅塵 心卻 是 安靜 的 我 不 驕 我 不 躁 我 曉 得 有 些 事情 是,5,0.18,不錯的應用希望越做越好還有一個地方好東西要分享給大家瀏覽器輸入下載簡體中文界面最大華人娛樂網站英國政府頒發執照安全無憂體育下注電競下注真人美女百家樂老虎機捕魚棋牌彩票電子游藝等各種頂級娛樂遊戲你找的裏面都有不去試試太可惜了瀏覽器輸入下載生活是開水不論冷熱只要有適合的溫度就好生活是口味不論酸甜苦辣只要有適合的口感就好生活是季節不論春夏秋冬只要有適合的心情就好生活就是實實在在的生存只要適合自己就是一種幸福莫要強求隨心就好莫要奢求安樂就好潮起潮落花開花落是自然界亙古不變的法則人也遵循着跌宕起伏在所難免關鍵在於能夠戒驕戒躁在頂端時好好享受在低谷時不失勇氣與其在風雨中逃避不如在雷電中舞蹈即便淋得透溼也是領略生命的怯意也許路途有點艱辛有點孤獨但熬過了痛苦我們才能得以成長我是一個淡淡的女子身在紅塵心卻是安靜的我不驕我不躁我曉得有些事情是,"[['不錯', '的', '應用', '希望', '越', '做', '越', '好', '還', '有', '一', '個', '地方', '好', '東西', '要', '分享給', '大家', '瀏覽器', '輸入', '下載', '簡體', '中文', '界面', '最', '大', '華人', '娛樂', '網站', '英國', '政府', '頒發', '執照', '安全', '無憂', '體育', '下', '注電', '競下注', '真人', '美女', '百家樂', '老虎機', '捕', '魚', '棋牌', '彩票', '電子', '游藝', '等', '各', '種', '頂級', '娛樂', '遊戲', '你', '找', '的', '裏面', '都', '有', '不', '去', '試試', '太', '可惜', '了', '瀏覽器', '輸入', '下載', '生活', '是', '開水', '不論', '冷熱', '只要', '有', '適合', '的', '溫度', '就', '好', '生活', '是', '口味', '不論', '酸甜苦辣', '只要', '有', '適合', '的', '口感', '就', '好', '生活', '是', '季節', '不論', '春', '夏', '秋冬', '只要', '有', '適合', '的', '心情', '就', '好', '生活', '就', '是', '實實在在', '的', '生存', '只要', '適合', '自己', '就', '是', '一', '種', '幸福', '莫', '要', '強求', '隨心', '就', '好莫', '要', '奢求', '安樂', '就', '好', '潮', '起', '潮', '落花', '開花落', '是', '自然界', '亙古', '不變', '的', '法則人', '也', '遵循', '着', '跌宕', '起伏', '在所難免', '關鍵', '在於', '能夠', '戒驕', '戒躁', '在', '頂端', '時', '好好', '享受', '在', '低谷', '時', '不失', '勇氣', '與其', '在', '風雨', '中', '逃避', '不如', '在', '雷電', '中', '舞蹈', '即便', '淋', '得', '透溼', '也', '是', '領略', '生命', '的', '怯意', '也許', '路途', '有點', '艱辛', '有點', '孤獨', '但', '熬過', '了', '痛苦', '我們', '才', '能', '得以', '成長', '我', '是', '一', '個', '淡淡', '的', '女子', '身在', '紅塵心', '卻', '是', '安靜', '的', '我', '不', '驕', '我', '不', '躁', '我', '曉得', '有', '些', '事情', '是']]",0
還 不錯,5,0.3,還不錯,"[['還', '不錯']]",0
好用,4,0.4,好用,[['好用']],0
好用 是 好用 但是 有 些 歌曲 都 找 不 到,4,0.4,好用是好用但是有些歌曲都找不到,"[['好用', '是', '好用', '但是', '有', '些', '歌曲', '都', '找', '不', '到']]",0
喜歡,5,0.5,喜歡,[['喜歡']],0
為什麼 沒有 泰語 的 音樂,4,-0.3,為什麼沒有泰語的音樂,"[['為什麼', '沒有', '泰語', '的', '音樂']]",0
最近 真的 很 不 穩定,1,0.3,最近真的很不穩定,"[['最近', '真的', '很', '不', '穩定']]",4
歌曲 種類 很 多元 甚至 連 系列 都 應有盡有 不過 前 一陣子 從 離線 跳轉回 線上 模式 後 有 一些 歌 多 是 動畫 電影 就 突然 無法 播放 了 點進去 專輯 也 沒 看到 歌曲 如果 是 授權 問題 希望 能 早日 解決,4,-0.1166666667,歌曲種類很多元甚至連系列都應有盡有不過前一陣子從離線跳轉回線上模式後有一些歌多是動畫電影就突然無法播放了點進去專輯也沒看到歌曲如果是授權問題希望能早日解決,"[['歌曲', '種類', '很', '多元', '甚至', '連', '系列', '都', '應有盡有', '不過', '前', '一陣子', '從', '離線', '跳轉回', '線上', '模式', '後', '有', '一些', '歌', '多', '是', '動畫', '電影', '就', '突然', '無法', '播放', '了', '點進去', '專輯', '也', '沒', '看到', '歌曲', '如果', '是', '授權', '問題', '希望', '能', '早日', '解決']]",0
不 錯 的 應 用 希望 越 做 越 好 還 有 一 個 地方 好 東西 要 分享 給 大家 瀏覽器輸入 下載簡體 中文 界面 最 大 華人娛樂網站 英國 政府 頒發執 照 安全無憂 體育 下注 電競 下 注 真人 美女 百家樂 老虎 機捕 魚 棋牌 彩票 電子 遊藝 等 各 種頂級娛樂 遊戲 你 找 的 裏面 都 有 不 去 試試 太 可惜 了 瀏覽器輸入 下載 孩結 婚後對 自己 妻子 比 結 婚前 更 好 一 次 聚會 朋友 笑 他 怎 麼結 婚 了 還 那 麼膩 他 笑着說道結 婚前 很多 男生 都 想 追 她 有 很多 男生 會對 她 好 我 只有 對 她 更 好 才 能 追到 她 結 婚後對 她 好 的 男生 越 來 越 少 我 只有 對 她 更 好 才 能 不 讓 她 失落 說完 所有 朋友 都 沉默 了 沒 有 嘲笑 只有 敬佩當 明天 變 成 了 今天 成爲 了 昨天 最 後成爲記憶裏 不再 重要 的 某 一 天 我 們 突然 發現 自己 在 不知不覺 中 已 被 時間 推着 向 前 走 這 不 是 在 靜 止 的 火車 裏與 相鄰 列車 交錯時 彷彿 自己 在 前 進 的 錯覺 而是 我 們 真實 的 在 成長 在 這 件 事裏 成 了 另 一 個 自己 習慣 了 每 天 進空間 看看 你 們 每 個 人 的 動態然後 知道 你 們誰過 得 開心誰 在 糾結誰 和 誰開 始 一 段 新,5,0.28,不錯的應用希望越做越好還有一個地方好東西要分享給大家瀏覽器輸入下載簡體中文界面最大華人娛樂網站英國政府頒發執照安全無憂體育下注電競下注真人美女百家樂老虎機捕魚棋牌彩票電子游藝等各種頂級娛樂遊戲你找的裏面都有不去試試太可惜了瀏覽器輸入下載孩結婚後對自己妻子比結婚前更好一次聚會朋友笑他怎麼結婚了還那麼膩他笑着說道結婚前很多男生都想追她有很多男生會對她好我只有對她更好才能追到她結婚後對她好的男生越來越少我只有對她更好才能不讓她失落說完所有朋友都沉默了沒有嘲笑只有敬佩當明天變成了今天成爲了昨天最後成爲記憶裏不再重要的某一天我們突然發現自己在不知不覺中已被時間推着向前走這不是在靜止的火車裏與相鄰列車交錯時彷彿自己在前進的錯覺而是我們真實的在成長在這件事裏成了另一個自己習慣了每天進空間看看你們每個人的動態然後知道你們誰過得開心誰在糾結誰和誰開始一段新,"[['不錯', '的', '應用', '希望', '越', '做', '越', '好', '還', '有', '一', '個', '地方', '好', '東西', '要', '分享給', '大家', '瀏覽器', '輸入', '下載', '簡體', '中文', '界面', '最', '大', '華人', '娛樂', '網站', '英國', '政府', '頒發', '執照', '安全', '無憂', '體育', '下', '注電', '競下注', '真人', '美女', '百家樂', '老虎機', '捕', '魚', '棋牌', '彩票', '電子', '游藝', '等', '各', '種', '頂級', '娛樂', '遊戲', '你', '找', '的', '裏面', '都', '有', '不', '去', '試試', '太', '可惜', '了', '瀏覽器', '輸入', '下載', '孩', '結婚', '後', '對', '自己', '妻子', '比', '結婚', '前', '更', '好', '一', '次', '聚會', '朋友', '笑', '他', '怎麼', '結婚', '了', '還', '那麼', '膩', '他', '笑着', '說道', '結婚', '前', '很多', '男生', '都', '想', '追', '她', '有', '很多', '男生', '會', '對', '她', '好', '我', '只有', '對', '她', '更', '好', '才', '能', '追到', '她', '結婚', '後', '對', '她', '好', '的', '男生', '越來越', '少', '我', '只有', '對', '她', '更', '好', '才', '能', '不', '讓', '她', '失落', '說完', '所有', '朋友', '都', '沉默', '了', '沒有', '嘲笑', '只有', '敬佩', '當', '明天', '變成', '了', '今天', '成爲', '了', '昨天', '最後', '成爲', '記憶', '裏', '不再', '重要', '的', '某', '一', '天', '我們', '突然', '發現', '自己', '在', '不知不覺', '中', '已', '被', '時間', '推着', '向', '前', '走', '這', '不', '是', '在', '靜止', '的', '火車', '裏', '與', '相鄰', '列車', '交錯', '時', '彷彿', '自己', '在', '前進', '的', '錯覺', '而是', '我們', '真實', '的', '在', '成長', '在', '這', '件', '事', '裏', '成', '了', '另', '一', '個', '自己', '習慣', '了', '每', '天', '進', '空間', '看看', '你們', '每', '個', '人', '的', '動態', '然後', '知道', '你們', '誰', '過', '得', '開心', '誰', '在', '糾結', '誰', '和', '誰', '開始', '一', '段', '新']]",0
曲,3,0,曲,[['曲']],0
本人 用 已經 很 久 了 但 愈來愈 多 歌 沒有 授權 不可以 聽用完 這 個 月 就 取消 訂閱 用 其他 聽 歌,1,-0.3333333333,本人用已經很久了但愈來愈多歌沒有授權不可以聽用完這個月就取消訂閱用其他聽歌,"[['本人', '用', '已經', '很', '久', '了', '但', '愈來愈', '多', '歌', '沒有', '授權', '不可以', '聽用完', '這', '個', '月', '就', '取消', '訂閱', '用', '其他', '聽', '歌']]",4
加 歌 太 繁瑣 了 不 便利 不 知 是 為何 感覺 有點 越 改 越 糟糕 啊,2,-0.3,加歌太繁瑣了不便利不知是為何感覺有點越改越糟糕啊,"[['加', '歌', '太', '繁瑣', '了', '不', '便利', '不', '知', '是', '為何', '感覺', '有點', '越', '改', '越', '糟糕', '啊']]",4
卸載 了 重新 下載 也 一 樣 所有 歌 都 是 秒秒 要 來幹 嘛,1,0,卸載了重新下載也一樣所有歌都是秒秒要來幹嘛,"[['卸載', '了', '重新', '下載', '也', '一樣', '所有', '歌', '都', '是', '秒秒', '要', '來', '幹嘛']]",4
