content,rating,sentiment,original_content,segment_content,_class
打擊感 強烈 配合度 高 策略性 強 可是 上 次 我 在 網址 有 玩 到 滿 鑽石 無限版 資源 道具 都 是 直接 無限 的 還 有 很多 遊戲 無限版 能 挑超爽 的 阿希望 遊戲 團隊 可以 優化 調整 一下 感謝 你們 的 辛勤 付出 很 久 沒有 這 麼 用心 的 玩 一 個 遊戲 了 本來 下載 這 個 遊戲 只是 想 隨便 玩玩 打發 時間 畢竟 現在 遊戲 選擇 很多 但 在 深入 了 解 遊戲 的 細節 再 加上 線上 盟友 日漸 累積 的 革命 情感 在 對抗 各 國 的 合作 下 對 這 個 遊戲 的 瞭解 就 越 深 再 來 遊戲 並 不 侷限 某 國 或 某 區域 在 強大 內建 翻譯 的 輔助 下 與 各 國 的 溝通 不 是 問題 更 添加 了 遊戲 的 豐富性 每 天 都 有 意猶未盡 的 感覺 值得 一 玩 再 玩,5,0.1363636364,打擊感強烈配合度高策略性強可是上次我在網址有玩到滿鑽石無限版資源道具都是直接無限的還有很多遊戲無限版能挑超爽的阿希望遊戲團隊可以優化調整一下感謝你們的辛勤付出很久沒有這麼用心的玩一個遊戲了本來下載這個遊戲只是想隨便玩玩打發時間畢竟現在遊戲選擇很多但在深入瞭解遊戲的細節再加上線上盟友日漸累積的革命情感在對抗各國的合作下對這個遊戲的瞭解就越深再來遊戲並不侷限某國或某區域在強大內建翻譯的輔助下與各國的溝通不是問題更添加了遊戲的豐富性每天都有意猶未盡的感覺值得一玩再玩,"[['打擊感', '強烈', '配合度', '高', '策略性', '強', '可是', '上', '次', '我', '在', '網址', '有', '玩', '到', '滿', '鑽石', '無限版', '資源', '道具', '都', '是', '直接', '無限', '的', '還', '有', '很多', '遊戲', '無限版', '能', '挑超爽', '的', '阿希望', '遊戲', '團隊', '可以', '優化', '調整', '一下', '感謝', '你們', '的', '辛勤', '付出', '很', '久', '沒有', '這麼', '用心', '的', '玩', '一', '個', '遊戲', '了', '本來', '下載', '這', '個', '遊戲', '只是', '想', '隨便', '玩玩', '打發', '時間', '畢竟', '現在', '遊戲', '選擇', '很多', '但', '在', '深入', '瞭解', '遊戲', '的', '細節', '再', '加上', '線上', '盟友', '日漸', '累積', '的', '革命', '情感', '在', '對抗', '各', '國', '的', '合作', '下', '對', '這', '個', '遊戲', '的', '瞭解', '就', '越', '深', '再', '來', '遊戲', '並', '不', '侷限', '某', '國', '或', '某', '區域', '在', '強大', '內建', '翻譯', '的', '輔助', '下', '與', '各', '國', '的', '溝通', '不', '是', '問題', '更', '添加', '了', '遊戲', '的', '豐富性', '每', '天', '都', '有', '意猶未盡', '的', '感覺', '值得', '一', '玩', '再', '玩']]",0
人 還是 比較 喜歡 的 從來 沒有 玩 過 這麼 久 的 手機 遊戲 聽說 去 到 能 玩 滿 元寶 無限版 進入 遊戲 就 全部 道具 資源 都 無限 用 超爽 的 傳承 經典 端遊 改編 而 成 的 遊戲 畫面 人物 畫面 都 美 的 讓 人 驚訝 而且 每 個 職業 都 有 自己 華麗 的 技能 我 最 喜歡 跟 朋友 一起 組隊 玩 排位 聯賽 非常 的 刺激 好玩 玩累 了 還可以 游泳 釣魚 讓 我 好 想 整 天 都 掛 在 遊戲 裡 真的 都 玩 不 膩 呢 呵呵 遊戲 很 好玩 提 個 小 建議 在 一 款 小 體量 的 單機 勇闖 地下城 裏 發現 的 一 點 就 是 一些 特殊 效果 詞條 的 裝備 似乎 在 當今 的 遊戲 裏 蠻 常見 例如 增加 技能 範圍 或者 飛行物 數量 或者 自動 釋放 壹 個 什麼 低 等級 的 技能 包括 像 些 常規 屬性 如 生命 回復類 的 詞條 可以 使 玩家 在 技能 以外 更加 極化 的 去 選擇 其他 玩法 流派 以上 就 是 個人 主觀 想法 吧 遊戲 能 有 一定 口碑 肯定 有 他 的 過人 之 處 還是 很 支持 的 加油 啊 畫風 新穎 我 想 這 次 在 最近 當中 出 的 一 款 很 好 的 遊戲 這 種 手遊 雖 沒有 到 不 常見 美中不足 就 是 不能 像 每 一 個 地方 都 環環相扣 讓 我 體驗到 遊戲 設計師 的 創意 小巧思 但是 真正 好玩 的 也 不 多 了 而且 人物 和 景色 處理 都 獨樹一格 每 一 個 地方 都 環環相扣 讓 我 體驗到 遊戲 設計師 的 創意 小巧思 非常 耐玩 而且 劇情 引人入勝,5,0.2416666667,人還是比較喜歡的從來沒有玩過這麼久的手機遊戲聽說去到能玩滿元寶無限版進入遊戲就全部道具資源都無限用超爽的傳承經典端遊改編而成的遊戲畫麪人物畫面都美的讓人驚訝而且每個職業都有自己華麗的技能我最喜歡跟朋友一起組隊玩排位聯賽非常的刺激好玩玩累了還可以游泳釣魚讓我好想整天都掛在遊戲裡真的都玩不膩呢呵呵遊戲很好玩提個小建議在一款小體量的單機勇闖地下城裏發現的一點就是一些特殊效果詞條的裝備似乎在當今的遊戲裏蠻常見例如增加技能範圍或者飛行物數量或者自動釋放壹個什麼低等級的技能包括像些常規屬性如生命回復類的詞條可以使玩家在技能以外更加極化的去選擇其他玩法流派以上就是個人主觀想法吧遊戲能有一定口碑肯定有他的過人之處還是很支持的加油啊畫風新穎我想這次在最近當中出的一款很好的遊戲這種手遊雖沒有到不常見美中不足就是不能像每一個地方都環環相扣讓我體驗到遊戲設計師的創意小巧思但是真正好玩的也不多了而且人物和景色處理都獨樹一格每一個地方都環環相扣讓我體驗到遊戲設計師的創意小巧思非常耐玩而且劇情引人入勝,"[['人', '還是', '比較', '喜歡', '的', '從來', '沒有', '玩', '過', '這麼', '久', '的', '手機', '遊戲', '聽說', '去', '到', '能', '玩', '滿', '元寶', '無限版', '進入', '遊戲', '就', '全部', '道具', '資源', '都', '無限', '用', '超爽', '的', '傳承', '經典', '端遊', '改編', '而', '成', '的', '遊戲', '畫麪', '人物', '畫面', '都', '美', '的', '讓', '人', '驚訝', '而且', '每', '個', '職業', '都', '有', '自己', '華麗', '的', '技能', '我', '最', '喜歡', '跟', '朋友', '一起', '組隊', '玩', '排位', '聯賽', '非常', '的', '刺激', '好玩', '玩累', '了', '還可以', '游泳', '釣魚', '讓', '我', '好', '想', '整', '天', '都', '掛', '在', '遊戲', '裡', '真的', '都', '玩', '不', '膩', '呢', '呵呵', '遊戲', '很', '好玩', '提', '個', '小', '建議', '在', '一', '款', '小', '體量', '的', '單機', '勇闖', '地下城', '裏', '發現', '的', '一', '點', '就', '是', '一些', '特殊', '效果', '詞條', '的', '裝備', '似乎', '在', '當今', '的', '遊戲', '裏', '蠻', '常見', '例如', '增加', '技能', '範圍', '或者', '飛行物', '數量', '或者', '自動', '釋放', '壹', '個', '什麼', '低等級', '的', '技能', '包括', '像', '些', '常規', '屬性', '如', '生命', '回復類', '的', '詞條', '可以', '使', '玩家', '在', '技能', '以外', '更加', '極化', '的', '去', '選擇', '其他', '玩法', '流派', '以上', '就', '是', '個人', '主觀', '想法', '吧', '遊戲', '能', '有', '一定', '口碑', '肯定', '有', '他', '的', '過人', '之', '處', '還是', '很', '支持', '的', '加油', '啊', '畫風', '新穎', '我', '想', '這', '次', '在', '最近', '當中', '出', '的', '一', '款', '很', '好', '的', '遊戲', '這', '種', '手遊', '雖', '沒有', '到', '不', '常見', '美中不足', '就', '是', '不能', '像', '每', '一', '個', '地方', '都', '環環相扣', '讓', '我', '體驗到', '遊戲', '設計師', '的', '創意', '小巧思', '但是', '真正', '好玩', '的', '也', '不', '多', '了', '而且', '人物', '和', '景色', '處理', '都', '獨樹一格', '每', '一', '個', '地方', '都', '環環相扣', '讓', '我', '體驗到', '遊戲', '設計師', '的', '創意', '小巧思', '非常', '耐玩', '而且', '劇情', '引人入勝']]",0
本來 看 四星 多 覺 的 可能 很 不錯 後來 看 一下 全部 都 是 機器人 再 洗 評點 實在 很 反感 連 下載 都 不 想 按 了,3,0.1666666667,本來看四星多覺的可能很不錯後來看一下全部都是機器人再洗評點實在很反感連下載都不想按了,"[['本來', '看', '四星', '多', '覺', '的', '可能', '很', '不錯', '後來', '看', '一下', '全部', '都', '是', '機器人', '再', '洗', '評點', '實在', '很', '反感', '連', '下載', '都', '不', '想', '按', '了']]",0
還 不 錯 的 付費 音樂 平臺 但是 中國 大陸 的 歌曲 實 在 太少 了 希望 能 夠納 入 更多 更 豐富 的 中國大陸 的 歌曲,4,0,還不錯的付費音樂平臺但是中國大陸的歌曲實在太少了希望能夠納入更多更豐富的中國大陸的歌曲,"[['還', '不錯', '的', '付費', '音樂', '平臺', '但是', '中國', '大陸', '的', '歌曲', '實在', '太少', '了', '希望', '能夠', '納入', '更多', '更', '豐富', '的', '中國', '大陸', '的', '歌曲']]",0
爛死 了 我 都 註冊 過 了 還 不 讓 我 登入 一直 要 我 註冊 下面 在 跟 我 說 我 註冊 過 了 又 不 讓 我 登入 是 有病 嗎,1,-0.7,爛死了我都註冊過了還不讓我登入一直要我註冊下面在跟我說我註冊過了又不讓我登入是有病嗎,"[['爛死', '了', '我', '都', '註冊', '過', '了', '還', '不', '讓', '我', '登入', '一直', '要', '我', '註冊', '下面', '在', '跟', '我', '說', '我', '註冊', '過', '了', '又', '不', '讓', '我', '登入', '是', '有病', '嗎']]",3
好聽 請 再 多 彙集 古典樂 合集 謝謝,4,0.5,好聽請再多彙集古典樂合集謝謝,"[['好聽', '請', '再', '多', '彙集', '古典樂', '合集', '謝謝']]",0
第一 次 用 還 不錯,5,0.3,第一次用還不錯,"[['第一', '次', '用', '還', '不錯']]",0
喜歡,5,0.5,喜歡,[['喜歡']],0
比 想象 中 好,5,0.3,比想象中好,"[['比', '想象', '中', '好']]",0
解約 解約 上 年料金 重複 徴 収 報告,1,-0.7,解約解約上年料金重複徴収報告,"[['解約', '解約', '上', '年料金', '重複', '徴', '収', '報告']]",4
遊戲 不錯 但 不能 一 次 觀看 全 隊員 的 裝備欄 有點 可惜 可是 上 次 我 在 網址 有 玩 到 滿 鑽石 無限版 資源 道具 都 是 直接 無限 的 還 有 很多 遊戲 無限版 能 挑 超爽 的 阿跳 脫 以往 當 勇者 打怪 的 思考 模式 玩起來 真的 非常 有趣 而且 會 一直 吸引人 繼續 玩下去 但 整 個 操作 介面 真的 太 小 了 玩 到 眼睛 非常 不 舒服 雖然 目前 轉移到 平板 之後 問題 解決 了 但 相對 也 會 降低 打開 遊戲 的 頻率 畢竟 還是 比較 常 把 手機 帶 在 身 上 有點 可惜,5,0.05714285714,遊戲不錯但不能一次觀看全隊員的裝備欄有點可惜可是上次我在網址有玩到滿鑽石無限版資源道具都是直接無限的還有很多遊戲無限版能挑超爽的阿跳脫以往當勇者打怪的思考模式玩起來真的非常有趣而且會一直吸引人繼續玩下去但整個操作介面真的太小了玩到眼睛非常不舒服雖然目前轉移到平板之後問題解決了但相對也會降低打開遊戲的頻率畢竟還是比較常把手機帶在身上有點可惜,"[['遊戲', '不錯', '但', '不能', '一', '次', '觀看', '全', '隊員', '的', '裝備欄', '有點', '可惜', '可是', '上', '次', '我', '在', '網址', '有', '玩', '到', '滿', '鑽石', '無限版', '資源', '道具', '都', '是', '直接', '無限', '的', '還', '有', '很多', '遊戲', '無限版', '能', '挑', '超爽', '的', '阿跳', '脫', '以往', '當', '勇者', '打怪', '的', '思考', '模式', '玩起來', '真的', '非常', '有趣', '而且', '會', '一直', '吸引人', '繼續', '玩下去', '但', '整', '個', '操作', '介面', '真的', '太', '小', '了', '玩', '到', '眼睛', '非常', '不', '舒服', '雖然', '目前', '轉移到', '平板', '之後', '問題', '解決', '了', '但', '相對', '也', '會', '降低', '打開', '遊戲', '的', '頻率', '畢竟', '還是', '比較', '常', '把', '手機', '帶', '在', '身', '上', '有點', '可惜']]",0
新 功能 說明 居然 貼 簡體字 咳咳,3,-0.3,新功能說明居然貼簡體字咳咳,"[['新', '功能', '說明', '居然', '貼', '簡體字', '咳咳']]",0
好用,5,0.4,好用,[['好用']],0
新 功能 變 簡體字,3,-0.3,新功能變簡體字,"[['新', '功能', '變', '簡體字']]",0
非常 好用 讚 啦,5,0.4,非常好用讚啦,"[['非常', '好用', '讚', '啦']]",0
哼歌 找 歌 還 滿 準 的,5,0,哼歌找歌還滿準的,"[['哼歌', '找', '歌', '還', '滿', '準', '的']]",0
相當 實用,5,0,相當實用,"[['相當', '實用']]",0
如果 支援 我 會 更 開心,3,-0.2,如果支援我會更開心,"[['如果', '支援', '我', '會', '更', '開心']]",0
爲什麼 有 時給 聽秒 有 時候 聽完 是 怎 樣 差 評,1,0,爲什麼有時給聽秒有時候聽完是怎樣差評,"[['爲', '什麼', '有時', '給', '聽', '秒', '有時候', '聽完', '是', '怎樣', '差評']]",4
滿意,5,0,滿意,[['滿意']],0
用 習慣 了 所以 一直 都 沒有 改 其他 音樂 但是 最近 有 個 缺點 就 是 搜歌 時 會 出現 不 對應 的 結果 假如 搜 的 卻 跑出來 一 大 堆 歌手 或 的 歌 沒有 一 首 是 我 要 的 那 首 蠻 奇怪 的 希望 官方 如 重視 這 個 問題 可以 加以 改善 謝謝,4,-0.3714285714,用習慣了所以一直都沒有改其他音樂但是最近有個缺點就是搜歌時會出現不對應的結果假如搜的卻跑出來一大堆歌手或的歌沒有一首是我要的那首蠻奇怪的希望官方如重視這個問題可以加以改善謝謝,"[['用', '習慣', '了', '所以', '一直', '都', '沒有', '改', '其他', '音樂', '但是', '最近', '有', '個', '缺點', '就', '是', '搜歌', '時', '會', '出現', '不', '對應', '的', '結果', '假如', '搜', '的', '卻', '跑出來', '一', '大', '堆', '歌手', '或', '的', '歌', '沒有', '一', '首', '是', '我', '要', '的', '那', '首', '蠻', '奇怪', '的', '希望', '官方', '如', '重視', '這', '個', '問題', '可以', '加以', '改善', '謝謝']]",0
朋友 介紹 我 可以 用 這 聽 歌 但是 我 長期 在 國外 出差 說 不 在 服務區 連加 會員 都 不能 加 雖然 月 要 回 臺灣 一 星期 但 之後 還是 要 出去 的 是 不 是 就算 成為 付費 會員 了 在 國外 一樣 不能 用,4,-0.1666666667,朋友介紹我可以用這聽歌但是我長期在國外出差說不在服務區連加會員都不能加雖然月要回臺灣一星期但之後還是要出去的是不是就算成為付費會員了在國外一樣不能用,"[['朋友', '介紹', '我', '可以', '用', '這', '聽', '歌', '但是', '我', '長期', '在', '國外', '出差', '說', '不', '在', '服務區', '連加', '會員', '都', '不能', '加', '雖然', '月', '要', '回', '臺灣', '一', '星期', '但', '之後', '還是', '要', '出去', '的', '是', '不', '是', '就算', '成為', '付費', '會員', '了', '在', '國外', '一樣', '不能', '用']]",0
希望 可以 改成 不用 付費,3,-0.1,希望可以改成不用付費,"[['希望', '可以', '改成', '不用', '付費']]",0
車用 模式 的 下方 按鈕 及 背景 希望 開放 黑色 系列 配色 暗黑,4,0,車用模式的下方按鈕及背景希望開放黑色系列配色暗黑,"[['車用', '模式', '的', '下方', '按鈕', '及', '背景', '希望', '開放', '黑色', '系列', '配色', '暗黑']]",0
讚,5,0,讚,[['讚']],0
一直 覺得 音質 很 糟糕 聲音 很 破用 耳機 感受 不 出來 聲音 外放 就 很 明顯 雖然 上 次 更新 好 很多 但是 比起 其他 串流 影音 及 還是 差異 很 明顯 且 聲音 調大 就 能 感受到 音質 的 落後 非常 可惜,3,0,一直覺得音質很糟糕聲音很破用耳機感受不出來聲音外放就很明顯雖然上次更新好很多但是比起其他串流影音及還是差異很明顯且聲音調大就能感受到音質的落後非常可惜,"[['一直', '覺得', '音質', '很', '糟糕', '聲音', '很', '破用', '耳機', '感受', '不', '出來', '聲音', '外放', '就', '很', '明顯', '雖然', '上', '次', '更新', '好', '很多', '但是', '比起', '其他', '串流', '影音', '及', '還是', '差異', '很', '明顯', '且', '聲音', '調大', '就', '能', '感受到', '音質', '的', '落後', '非常', '可惜']]",0
髒聽 個 英文 排行 還要 加入 韓國歌 是 要 跪舔 韓國 的 什麼 時候 呢,1,-0.6,髒聽個英文排行還要加入韓國歌是要跪舔韓國的什麼時候呢,"[['髒聽', '個', '英文', '排行', '還要', '加入', '韓國歌', '是', '要', '跪舔', '韓國', '的', '什麼', '時候', '呢']]",4
美麥 用,5,0,美麥用,"[['美麥', '用']]",0
昨日 的 閃退 今日 已 回復 正常,5,-0.7,昨日的閃退今日已回復正常,"[['昨日', '的', '閃退', '今日', '已', '回復', '正常']]",0
很多 抖音 包括 顏人 中 隔壁 老樊 的 歌 都 無法聽 到 說 是 所在地 區沒 有 版權 就算 是 白金會員 也 有 不 公平 的 地區 限制,2,0.1,很多抖音包括顏人中隔壁老樊的歌都無法聽到說是所在地區沒有版權就算是白金會員也有不公平的地區限制,"[['很多', '抖音', '包括', '顏人', '中', '隔壁', '老樊', '的', '歌', '都', '無法', '聽到', '說', '是', '所在', '地區', '沒有', '版權', '就算', '是', '白金', '會員', '也', '有', '不', '公平', '的', '地區', '限制']]",4
有 收到 回覆 雖然 最後 沒 得到 版權 但 還是 很 感謝 至少 知道 消息 因為 這 個 進步 而 改回 五 顆 星 以 表 感謝,5,0.3666666667,有收到回覆雖然最後沒得到版權但還是很感謝至少知道消息因為這個進步而改回五顆星以表感謝,"[['有', '收到', '回覆', '雖然', '最後', '沒', '得到', '版權', '但', '還是', '很', '感謝', '至少', '知道', '消息', '因為', '這', '個', '進步', '而', '改回', '五', '顆', '星', '以', '表', '感謝']]",0
這 款 能夠 給 人 帶來 視覺 與 聽覺 上 的 享受 以後 再 也 不會 無聊 還 有 壹 個 特別 的 小 技巧 告訴 大家 在 這裏 下載 的 版本 可以 滿 不用 自己 充 這 款 卡牌 手遊 真是 給力 畫面 震撼 視覺 沖擊感 強烈 多 款 技能 搭配 的 創新 玩法 打造 極致 的 試玩 體驗 全面 的 立體 社交 帶來 不 壹樣 的 暢玩 感受 以及 帶來 深刻 的 角色 扮演 感對 它 情有獨鐘 絕對 是 有 理由 的 遊戲 精彩 無限 建築 工地 設計 完美 結合 非常 喜歡 如果 有 多些 功能 更加 好 這樣 玩起來 會 更 刺激 更 耐玩 如果 可以 的話 希望 在 建設 過程 自主 選擇 喜歡 的 地方 開發 裝修 風格 自主 設計 會 更 完美 啦 遊戲 用戶 可以 自由 選擇 自己 的 夥伴 組隊參 加比賽 一切 要 新穎 刺激 獨特風格爲基礎 才 能 更 好 地 吸引 所有 的 客戶 羣體 希望 這個 遊戲 好 快 有 新 的 玩法 期待,5,0.3476190476,這款能夠給人帶來視覺與聽覺上的享受以後再也不會無聊還有壹個特別的小技巧告訴大家在這裏下載的版本可以滿不用自己充這款卡牌手遊真是給力畫面震撼視覺沖擊感強烈多款技能搭配的創新玩法打造極致的試玩體驗全面的立體社交帶來不壹樣的暢玩感受以及帶來深刻的角色扮演感對它情有獨鐘絕對是有理由的遊戲精彩無限建築工地設計完美結合非常喜歡如果有多些功能更加好這樣玩起來會更刺激更耐玩如果可以的話希望在建設過程自主選擇喜歡的地方開發裝修風格自主設計會更完美啦遊戲用戶可以自由選擇自己的夥伴組隊參加比賽一切要新穎刺激獨特風格爲基礎才能更好地吸引所有的客戶羣體希望這個遊戲好快有新的玩法期待,"[['這', '款', '能夠', '給', '人', '帶來', '視覺', '與', '聽覺', '上', '的', '享受', '以後', '再', '也', '不會', '無聊', '還', '有', '壹', '個', '特別', '的', '小', '技巧', '告訴', '大家', '在', '這裏', '下載', '的', '版本', '可以', '滿', '不用', '自己', '充', '這', '款', '卡牌', '手遊', '真是', '給力', '畫面', '震撼', '視覺', '沖擊感', '強烈', '多', '款', '技能', '搭配', '的', '創新', '玩法', '打造', '極致', '的', '試玩', '體驗', '全面', '的', '立體', '社交', '帶來', '不', '壹樣', '的', '暢玩', '感受', '以及', '帶來', '深刻', '的', '角色', '扮演', '感對', '它', '情有獨鐘', '絕對', '是', '有', '理由', '的', '遊戲', '精彩', '無限', '建築', '工地', '設計', '完美', '結合', '非常', '喜歡', '如果', '有', '多些', '功能', '更加', '好', '這樣', '玩起來', '會', '更', '刺激', '更', '耐玩', '如果', '可以', '的話', '希望', '在', '建設', '過程', '自主', '選擇', '喜歡', '的', '地方', '開發', '裝修', '風格', '自主', '設計', '會', '更', '完美', '啦', '遊戲', '用戶', '可以', '自由', '選擇', '自己', '的', '夥伴', '組隊', '參加', '比賽', '一切', '要', '新穎', '刺激', '獨特', '風格', '爲', '基礎', '才', '能', '更', '好', '地', '吸引', '所有', '的', '客戶', '羣體', '希望', '這', '個', '遊戲', '好', '快', '有', '新', '的', '玩法', '期待']]",0
用 了 好幾 年 了 沒 什麼 大 問題 唯一 問題 是 最近 幾 個 月 開始 連接 藍芽 喇叭 的 播放 聲音 比 以前 小 很多,4,-0.2,用了好幾年了沒什麼大問題唯一問題是最近幾個月開始連接藍芽喇叭的播放聲音比以前小很多,"[['用', '了', '好幾', '年', '了', '沒', '什麼', '大', '問題', '唯一', '問題', '是', '最近', '幾', '個', '月', '開始', '連接', '藍芽', '喇叭', '的', '播放', '聲音', '比', '以前', '小', '很多']]",0
介面 需 再 優化 選項 太 多餘 與 複雜 不 人性化,3,-0.2666666667,介面需再優化選項太多餘與複雜不人性化,"[['介面', '需', '再', '優化', '選項', '太', '多餘', '與', '複雜', '不', '人性化']]",0
很 好用,5,0.4,很好用,"[['很', '好用']]",0
非常 流暢,5,0.3,非常流暢,"[['非常', '流暢']]",0
太 麻煩 了,1,0,太麻煩了,"[['太', '麻煩', '了']]",4
為什麼 新 功能 的 介紹 是 簡體,3,-0.3,為什麼新功能的介紹是簡體,"[['為什麼', '新', '功能', '的', '介紹', '是', '簡體']]",0
很多 歌,4,0,很多歌,"[['很多', '歌']]",0
為什麼 只 能 聼 三十 秒,2,-0.3,為什麼只能聼三十秒,"[['為什麼', '只', '能', '聼', '三十', '秒']]",4
好用 希望 有 更多 歌,4,0.4,好用希望有更多歌,"[['好用', '希望', '有', '更多', '歌']]",0
邊 聽 邊 下載 能不能 新增 儘 下載 加 到 最愛 的 歌曲,3,0.5,邊聽邊下載能不能新增儘下載加到最愛的歌曲,"[['邊', '聽', '邊', '下載', '能不能', '新增', '儘', '下載', '加', '到', '最愛', '的', '歌曲']]",0
好用,5,0.4,好用,[['好用']],0
歌曲量 足夠 但 日文 歌 的 歌名 是 英文 拼音 有點 麻煩,5,-0.7,歌曲量足夠但日文歌的歌名是英文拼音有點麻煩,"[['歌曲量', '足夠', '但', '日文', '歌', '的', '歌名', '是', '英文', '拼音', '有點', '麻煩']]",0
這 次 更新 總算 有感 了 目前 聽 音樂 不會 有 中斷 的 問題 了,5,-0.2,這次更新總算有感了目前聽音樂不會有中斷的問題了,"[['這', '次', '更新', '總算', '有感', '了', '目前', '聽', '音樂', '不會', '有', '中斷', '的', '問題', '了']]",0
爛爆,1,-0.7,爛爆,[['爛爆']],4
已經 在 中華 電信 付費 成為 白金 會員 可是 開啟 還是 一般 會員 一直 顯示 要 付費 申級 為什麼,2,-0.1666666667,已經在中華電信付費成為白金會員可是開啟還是一般會員一直顯示要付費申級為什麼,"[['已經', '在', '中華', '電信', '付費', '成為', '白金', '會員', '可是', '開啟', '還是', '一般', '會員', '一直', '顯示', '要', '付費', '申級', '為什麼']]",4
登錄 很 久 常常 無法 登錄 快 不 想 用 了,2,-0.5,登錄很久常常無法登錄快不想用了,"[['登錄', '很', '久', '常常', '無法', '登錄', '快', '不', '想', '用', '了']]",3
還 以為 真的 找到 一 款 免費 離線 音樂 到頭來 還是 叫 你 付錢 不然 一 首 都 不 給 你 聽,2,-0.3,還以為真的找到一款免費離線音樂到頭來還是叫你付錢不然一首都不給你聽,"[['還', '以為', '真的', '找到', '一', '款', '免費', '離線', '音樂', '到頭來', '還是', '叫', '你', '付錢', '不然', '一', '首', '都', '不', '給', '你', '聽']]",4
罷免 高雄 市長 韓國 喵 公民 割草 囉,5,-0.5,罷免高雄市長韓國喵公民割草囉,"[['罷免', '高雄', '市長', '韓國', '喵', '公民', '割草', '囉']]",0
希望 可以 多 新增 一些 歌,3,0,希望可以多新增一些歌,"[['希望', '可以', '多', '新增', '一些', '歌']]",0
